{
  "$schema": "./fuzzy-commands.schema.json",
  "version": 1,
  "aliases": {
    "aios": "aioswiki",
    "w": "aioswiki",
    "wiki": "aioswiki"
  },
  "wiki_aliases": ["aios", "w", "wiki"],
  "commands": [
    "aioswiki", "wiki", "project-init", "project-open", "project-info",
    "run", "shell", "app", "log"
  ],
  "fuzzy": {
    "enabled": true,
    "threshold": 0.8,
    "auto_execute": false
  }
}
